{
  "$schema": "https://json-schema.org/draft/2020-12/schema",
  "title": "PS5 React app",
  "type": "object",
  "required": [
    "titleId",
    "contentId",
    "name",
    "version",
    "render",
    "surface",
    "timeoutSeconds"
  ],
  "properties": {
    "$schema": {
      "type": "string"
    },
    "titleId": {
      "type": "string",
      "pattern": "^PPSA[0-9]{5}$",
      "description": "Unique homebrew title ID; do not reuse an installed application ID."
    },
    "contentId": {
      "type": "string",
      "pattern": "^[A-Z]{2}[0-9]{4}-PPSA[0-9]{5}_00-[A-Z0-9]{16}$"
    },
    "name": {
      "type": "string",
      "minLength": 1,
      "maxLength": 80
    },
    "version": {
      "type": "string",
      "pattern": "^[0-9]{2}\\.[0-9]{3}\\.[0-9]{3}$"
    },
    "timeoutSeconds": {
      "type": "integer",
      "minimum": 0,
      "maximum": 3600,
      "description": "Seconds after first frame until closure; 0 disables the timeout."
    },
    "render": {
      "type": "object",
      "required": [
        "width",
        "height"
      ],
      "properties": {
        "width": {
          "type": "integer",
          "minimum": 1,
          "maximum": 3840
        },
        "height": {
          "type": "integer",
          "minimum": 1,
          "maximum": 3840
        }
      },
      "additionalProperties": false
    },
    "surface": {
      "type": "object",
      "required": [
        "width",
        "height"
      ],
      "properties": {
        "width": {
          "type": "integer",
          "minimum": 1,
          "maximum": 3840
        },
        "height": {
          "type": "integer",
          "minimum": 1,
          "maximum": 3840
        }
      },
      "additionalProperties": false
    },
    "filesystemAccess": {
      "type": "string",
      "enum": [
        "sandbox",
        "console"
      ],
      "default": "sandbox",
      "description": "console packages the pinned Lapy helper and requests filesystem access at startup; requires local elfldr on port 9021 or resident Lapy."
    },
    "networking": {
      "type": "boolean",
      "default": false,
      "description": "Enable native HTTP and large-file downloads; PS5 requires filesystemAccess: console. Desktop networking is available independently."
    }
  },
  "additionalProperties": false,
  "allOf": [
    {
      "if": {
        "required": [
          "networking"
        ],
        "properties": {
          "networking": {
            "const": true
          }
        }
      },
      "then": {
        "required": [
          "filesystemAccess"
        ],
        "properties": {
          "filesystemAccess": {
            "const": "console"
          }
        }
      }
    }
  ]
}
