{
  "$schema": "../../app.schema.json",
  "titleId": "PPSA99053",
  "contentId": "UP9000-PPSA99053_00-PS5REACTSTARTER1",
  "name": "PS5 React Starter",
  "version": "01.000.000",
  "render": {
    "width": 2560,
    "height": 1440
  },
  "surface": {
    "width": 1920,
    "height": 1080
  },
  "timeoutSeconds": 30
}
